,VCCS Course,VCCS Description,VT Course Code,VT Course Title,VT Description
0,ACC 211 PRINCIPLES OF ACCOUNTING I,"Introduces accounting principles with respect to financial reporting. Demonstrates how decision makers use accounting information for reporting purposes. Focuses on the preparation of accounting information and its use in the operation of organizations, as well as methods of analysis and interpretation of accounting information.",ACIS 2115,PRINCIPLES OF ACCOUNTING,"Introduction to financial and managerial accounting. 2115: Emphasis on the financial accounting cycle. Discusses accounting information uses, fraud, and internal controls. Analysis of financial statement elements: assets, liabilities, stockholders’ equity, revenues, and expenses. 2116: Emphasis on budgeting and accounting information decision-making. Discusses management accounting and cost concepts. Use of job order costing and cost value profit relationships. Use of variable costing and segment reporting. Create external financial reporting documents."
1,ACC 212 PRINCIPLES OF ACCOUNTING II,"Introduces accounting principles with respect to cost and managerial accounting. Focuses on the application of accounting information with respect to product costing, as well as its use within the organization to provide direction and to judge performance.",ACIS 2116,PRINCIPLES OF ACCOUNTING,"Introduction to financial and managerial accounting. 2115: Emphasis on the financial accounting cycle. Discusses accounting information uses, fraud, and internal controls. Analysis of financial statement elements: assets, liabilities, stockholders’ equity, revenues, and expenses. 2116: Emphasis on budgeting and accounting information decision-making. Discusses management accounting and cost concepts. Use of job order costing and cost value profit relationships. Use of variable costing and segment reporting. Create external financial reporting documents."
2,ADJ 201 CRIMINOLOGY,Studies current and historical data pertaining to criminal and other deviant behavior. Examines theories that explain crime and criminal behavior in human society.,SOC 2404,DEVIANT BEHAVIOR,"Examines behaviors considered deviant in the United States. Explores major types of deviant behavior, such as corporate crimes, extremist groups, sexual deviance, violence, suicide, alcoholism and other drug addictions, and cyber deviance. Includes sociological theories that explain them."
3,ADJ 247 CRIMINAL BEHAVIOR,Introduces and evaluates the concepts of normal and abnormal behavior. Focuses on the psychological and sociological aspects of criminal and other deviant behavior patterns.,SOC 2404,DEVIANT BEHAVIOR,"Examines behaviors considered deviant in the United States. Explores major types of deviant behavior, such as corporate crimes, extremist groups, sexual deviance, violence, suicide, alcoholism and other drug addictions, and cyber deviance. Includes sociological theories that explain them."
4,AGR 143 INTRO TO AGRIBUSINESS AND FINANCIAL MANAGEMENT,"Introduces agriculture's importance to society and ways to start a farm or agribusiness.  Evaluates forms of business including cooperatives and create financial statements and reports necessary for routine accounting and tax preparation.  Utilizes financial tools for decision making, budgets and time value of money.  Explores retirement, transition planning, personal financial management, and capital acquisition techniques.",AAEC 2434,FOUNDATIONS IN AGRIBUS,Introduction to the primary management tools as they relate to farm production enterprises and agribusinesses. Principles and concepts of preparing farm and agribusiness financial statements and their analysis.  Application of budgeting and risk management.
5,ART 101 HISTORY OF ART: PREHISTORIC TO GOTHIC,"Surveys the history and interpretation of architecture, painting and sculpture from the prehistoric era through the Gothic. This is a Passport and UCGS transfer course.",ART 2385,SURVEY OF THE HISTORY OF WESTERN ART,"Survey of the visual arts and architecture from prehistoric times to the present day with emphasis on Western Europe including functions of visual arts and architecture, terms of visual literacy and methods of formal visual analysis. 2385: Focus on prehistoric time to the thirteenth century including Paleolithic, Neolithic, Ancient Near Eastern, Egyptian, Aegean, Greek, Roman, Byzantine, medieval and early Gothic art.  2386: Focus on late Gothic through present day including Renaissance, Baroque, 19th (Romanticism to Post-Impressionism) and 20th centuries (cubism to postmodernism)."
6,ART 102 HISTORY OF ART: RENAISSANCE TO MODERN,"Surveys the history and interpretation of architecture, painting and sculpture from the Renaissance through the modern era. This is a Passport and UCGS transfer course.",ART 2386,SURVEY OF THE HISTORY OF WESTERN ART,"Survey of the visual arts and architecture from prehistoric times to the present day with emphasis on Western Europe including functions of visual arts and architecture, terms of visual literacy and methods of formal visual analysis. 2385: Focus on prehistoric time to the thirteenth century including Paleolithic, Neolithic, Ancient Near Eastern, Egyptian, Aegean, Greek, Roman, Byzantine, medieval and early Gothic art.  2386: Focus on late Gothic through present day including Renaissance, Baroque, 19th (Romanticism to Post-Impressionism) and 20th centuries (cubism to postmodernism)."
7,ART 121 FOUNDATIONS OF DRAWING,"Develops basic drawing skills and understanding of visual language through studio instruction/lecture. Introduces concepts such as line, proportion, space, perspective, value and composition as applied to still life, landscape and figure. Uses drawing media such as pencil, charcoal and ink wash. Includes field trips and gallery assignments as appropriate. This is a UCGS transfer course.",ART 1404,PRINCIPLES OF DRAWING,"Elements, methods and skills fundamental to drawing. Investigates formal elements fundamental to drawing such as line, space, form, value and texture, through drawing tools and methods. Emphasis on controlled use of common drawing media for representational and expressive purposes. Examination of multiple intercultural viewpoints through exercises and discussion investigating topics that vary by semester. Application of formal analysis and interpretive strategies through critique. Lecture (1H,1C), Lab (3L,1C), Design Lab/Studio (2L,1C). RESOURCE CHARGE. (1H,5L,3C)"
8,ART 131 TWO-DIMENSIONAL DESIGN,"Introduces the elements and principles of design as applied to two-dimensional studio projects. Introduces two-dimensional media, techniques, compositional strategies, and color concepts and interactions. Supports conceptual development through introduction to historical and contemporary practices and critical analysis. May include field trips as required. This is a UCGS transfer course.",ART 1204,PRINCIPLES OF 2D ART AND DESIGN,"Elements and methods fundamental to two-dimensional art and design. Investigates formal elements and principles of two-dimensional design including shape, color, balance, rhythm, hierarchy, and unity. Exploration of analog and digital strategies in image making through iterative, hands-on processes. Interpretation of historical and contemporary two-dimensional art and design from around the globe to discover communication strategies in an intercultural context. Application of formal analysis and interpretive strategies through critique. Lecture (1H,1C), Lab (3L,1C), Design Lab/Studio (2L,1C). RESOURCE CHARGE. (1H,5L,3C)"
9,ART 132 THREE-DIMENSIONAL DESIGN,"Introduces the elements and principles of design as applied to three-dimensional studio projects. Introduces three-dimensional media, techniques, compositional strategies, and color concepts and interactions. Supports conceptual development through introduction to historical and contemporary practices and critical analysis. May include field trips as required. This is a UCGS transfer course.",ART 1214,PRINCIPLES OF 3D ART AND DESIGN,"Elements and methods fundamental to three-dimensional art and design. Investigates formal elements and principles of three-dimensional design including line, plane, form, mass, space, scale and surface. Exploration of analog and digital strategies in three-dimensional object making through iterative, hands-on processes. Interpretation of historical and contemporary three-dimensional art and design from around the globe to discover communication strategies in an intercultural context. Application of formal analysis and interpretive strategies through critique. Lecture (1H,1C), Lab (3L,1C), Design Lab/Studio (2L,1C). RESOURCE CHARGE. (1H,5L,3C)"
10,ART 145 INTRODUCTION TO FASHION DESIGN,"Introduces the essential elements of fashion design.  Includes the study of garment silhouette and terminology, basic drawing skills of the fashion figure and garments, creating flats, using croquis, rendering fabrics, designing a fashion line, and understanding the apparel manufacturing and freelance design industries.",FMD 2264,APPAREL PRODUCT DEVELOPMENT,"Study of the pre-production stage of product development in the apparel industry, including planning a line based on market, consumer, and product research, forecasting trends in color, style and materials, developing and selecting designs and styles, and wholesale marketing of a line to retail buyers. Also includes the use of diverse inspiration sources for creating a design, application of computer-aided design to design and style development, and identification of career opportunities and qualifications for professional positions in the industry. Sophomore Standing required."
11,ART 148 GARMENT CONSTRUCTION,Gives students a foundational understanding of garment construction and fabric manipulation in order to create apparel. Includes the fundamentals of hand and machine sewing techniques and basic pattern symbols.,FMD 3224,APPAREL ASSEMBLY,"Systematizing and assembling garment applications for the apparel industry. Conceptual study of simple to complex apparel construction techniques, stitch and seam types, cost-effective measures, applications with manual manipulation, computers, tools, and equipment."
12,ART 160 FILM PRODUCTION I,"Introduces students to the basic techniques and procedures involved in motion picture production. Emphasizes aspects of filmmaking from scripting and preproduction through editing and postproduction. Includes the exploration of professional film crew roles in grip, lighting, production management, directing, sound and editing.",CINE 2064,INTRODUCTION TO CINEMA PRODUCTION,"Introductory filmmaking course. Thematic conception and story construction, writing, producing, directing, cinematography, sound recording, and editing."
13,BIO 100 BASIC HUMAN BIOLOGY,"Presents basic principles of human anatomy and physiology. Discusses cells, tissues, and selected human systems.",BIOL 1054,HUMAN BIOLOGY: CONCEPTS AND CURRENT ISSUES,"Survey of human biology, including physiology, genetics, evolution, and ecology. Focus on homeostasis, including factors and choices that disrupt homeostasis and health. Examination of technological advances and ethical issues associated with the biology of humans. Personal and societal choices that impact human ecology."
14,BIO 101 GENERAL BIOLOGY I,"Focuses on biological processes with a chemical foundation, including macromolecules, cellular structure, metabolism, and genetics in an evolutionary context. Explores the core concepts of evolution; structure and function; information flow, storage and exchange; pathways and transformations of energy and matter; and systems biology. Emphasizes the process of science, interdisciplinary approach, and relevance of biology to society. Part I of a two-course sequence. Assignments require college-level reading fluency, coherent written communication, and basic mathematical skills. This is a Passport and UCGS transfer course. Credit toward graduation cannot be awarded for both BIO 101 and BIO 106 .",BIOL 1105 + BIOL 1115,PRINCIPLES OF BIOLOGY + LAB,"Introduction to the science of biology. 1105: living systems; biological molecules; cell structure, function, and reproduction; cellular energetics and metabolism; expression and inheritance of genetic information; evolution; ethical implications of research and discovery in these areas. 1106: animal and plant anatomy and physiology, ecology, and animal behavior; ethical implications of research and discovery in these areas. (1105 duplicates 1005, 1014; 1106 duplicates 1006, 1014. Credit for 1014 will be disallowed if 1105 or 1106 are taken after earning credit for 1014) | Emphasizes biological principles through investigative exercises and collaborative learning.  1115:  cell chemistry, physiology and reproduction and genetics; 1116: plant and animal form and function, and ecology.  Primarily for students majoring in the life sciences. (Duplicates 1015 1016, 1125, 1126)."
15,BIO 102 GENERAL BIOLOGY II,"Focuses on biological processes with a chemical foundation, including macromolecules, cellular structure, metabolism, and genetics in an evolutionary context. Explores the core concepts of evolution; structure and function; information flow, storage and exchange; pathways and transformations of energy and matter; and systems biology. Emphasizes the process of science, interdisciplinary approach, and relevance of biology to society. Part II of a two-course sequence. This is a UCGS transfer course.",BIOL 1106 + BIOL 1116,PRINCIPLES OF BIOLOGY + LAB,"Introduction to the science of biology. 1105: living systems; biological molecules; cell structure, function, and reproduction; cellular energetics and metabolism; expression and inheritance of genetic information; evolution; ethical implications of research and discovery in these areas. 1106: animal and plant anatomy and physiology, ecology, and animal behavior; ethical implications of research and discovery in these areas. (1105 duplicates 1005, 1014; 1106 duplicates 1006, 1014. Credit for 1014 will be disallowed if 1105 or 1106 are taken after earning credit for 1014). | Emphasizes biological principles through investigative exercises and collaborative learning.  1115:  cell chemistry, physiology and reproduction and genetics; 1116: plant and animal form and function, and ecology.  Primarily for students majoring in the life sciences."
16,BIO 141 HUMAN ANATOMY & PHYSIOLOGY I,"Presents the study of anatomy & physiology including anatomical terminology, homeostasis, histology, integumentary system, skeletal system, muscular system, and nervous system. Part I of II.  Assignments require college-level reading fluency, coherent written communication, and basic mathematical skills.",BMSP 2135 + BMSP 2145,HUMAN ANATOMY AND PHYSIOLOGY + LAB,"Structure and function of the human body for students preparing for professions in the health fields. 2135: body plan and organization, homeostasis, cell structure and function, histology, integumentary system, skeletal system, muscular system, nervous system and special senses. 2136: endocrine system, circulatory & cardiovascular system, lymphatic system and immunity, respiratory system, digestive system, metabolism, excretion, reproduction, and development. BMSP 2135 -2136 duplicates BIOL 2405-2406; may not receive credit for both. | Laboratory exercises investigating the structure and function of the human body for students preparing for professions in the health fields.  2145: body plan and organization, homeostasis, cell structure and function, histology, integumentary system, skeletal system, muscular system, nervous system and special senses. 2146: endocrine system, circulatory & cardiovascular system, lymphatic system and immunity, respiratory system, digestive system, metabolism, excretion, reproduction, and development. BMSP 2145 -2146 duplicates BIOL 2414; may not receive credit for both."
17,BIO 142 HUMAN ANATOMY & PHYSIOLOGY II,"Continues study of anatomy and physiology including endocrine system, blood and cardiovascular system, lymphatic system and immunity, respiratory system, urinary system, fluid, electrolyte, and acid-base balance, digestive system and nutrient metabolism, reproductive system, and prenatal development. Part II of II.",BMSP 2136 + BMSP 2146,HUMAN ANATOMY AND PHYSIOLOGY + LAB,"Structure and function of the human body for students preparing for professions in the health fields. 2135: body plan and organization, homeostasis, cell structure and function, histology, integumentary system, skeletal system, muscular system, nervous system and special senses. 2136: endocrine system, circulatory & cardiovascular system, lymphatic system and immunity, respiratory system, digestive system, metabolism, excretion, reproduction, and development. BMSP 2135 -2136 duplicates BIOL 2405-2406; may not receive credit for both. | Laboratory exercises investigating the structure and function of the human body for students preparing for professions in the health fields.  2145: body plan and organization, homeostasis, cell structure and function, histology, integumentary system, skeletal system, muscular system, nervous system and special senses. 2146: endocrine system, circulatory & cardiovascular system, lymphatic system and immunity, respiratory system, digestive system, metabolism, excretion, reproduction, and development. BMSP 2145 -2146 duplicates BIOL 2414; may not receive credit for both."
18,BIO 150 MICROBIOLOGY FOR HEALTH SCIENCES,"Focuses on the general characteristics, cellular structure, and metabolism of microorganisms. Emphasizes microbial relationships with individual and community health. Includes impact of microbes on human health and disease, microbial pathogenicity, identifying and managing infectious diseases and controlling microbial growth, healthcare associated infections and epidemiology. Studies aseptic culturing techniques with hands-on experience in safe microbiology practices.",BIOL 2604 + BIOL 2614,GENERAL MICROBIOLOGY + LAB,"Microbial structure, function, metabolism, genetics and ecology.  The role of microorganisms in host/parasite relationships will be emphasized. | Introduction to microbiological techniques and procedures. Aseptic technique and safe handling.  Culture, characterization, and identification of microorganisms."
19,BIO 205 GENERAL MICROBIOLOGY,"Explores the structure and function of microorganisms and their relationship to the environment and humans. Emphasizes the various groups of microorganisms, their growth and metabolism, roles in the functioning of ecosystems, genetics, their roles in human health, the use of microbes in industrial applications and biotechnology and methods of microbial control.",BIOL 2604 + BIOL 2614,GENERAL MICROBIOLOGY + LAB,"Microbial structure, function, metabolism, genetics and ecology.  The role of microorganisms in host/parasite relationships will be emphasized. | Introduction to microbiological techniques and procedures. Aseptic technique and safe handling.  Culture, characterization, and identification of microorganisms."
20,BIO 206 CELL BIOLOGY,"Introduces the ultrastructure and functions of cells. Emphasizes cell metabolism, cell division, and control of gene expression.",BIOL 2134 + BIOL 3104,CELL FUNCTION AND DIFFERENTIATION + CELL AND MOLECULAR BIOLOGY LABORATORY,"Fundamental mechanisms essential for cell function.  Methods used to study cells.  Cellular structure and physiology, energy production, cell survival and reproduction.  Cell interactions and communication, stem cells, cell differentiation, tissue formation. | Introduction to methods used to study prokaryotic and eukaryotic cells. Recombinant DNA, protein expression and purification, the polymerase chain reaction, bioinformatics, and microscopy."
21,BIO 231 HUMAN ANATOMY & PHYSIOLOGY I,"Integrates the study of gross and microscopic human anatomy with physiology, emphasizing the analysis and interpretation of physiological parameters, as they relate to clinical scenarios. Covers the integumentary system, skeletal system (including articulations), muscular system, and nervous system. Part I of II.",BMSP 2135 + BMSP 2145,HUMAN ANATOMY AND PHYSIOLOGY + LAB,"Structure and function of the human body for students preparing for professions in the health fields. 2135: body plan and organization, homeostasis, cell structure and function, histology, integumentary system, skeletal system, muscular system, nervous system and special senses. 2136: endocrine system, circulatory & cardiovascular system, lymphatic system and immunity, respiratory system, digestive system, metabolism, excretion, reproduction, and development. BMSP 2135 -2136 duplicates BIOL 2405-2406; may not receive credit for both. | Laboratory exercises investigating the structure and function of the human body for students preparing for professions in the health fields.  2145: body plan and organization, homeostasis, cell structure and function, histology, integumentary system, skeletal system, muscular system, nervous system and special senses. 2146: endocrine system, circulatory & cardiovascular system, lymphatic system and immunity, respiratory system, digestive system, metabolism, excretion, reproduction, and development. BMSP 2145 -2146 duplicates BIOL 2414; may not receive credit for both."
22,BIO 232 HUMAN ANATOMY & PHYSIOLOGY II,"Integrates the study of gross and microscopic human anatomy with physiology, emphasizing the analysis and interpretation of physiological parameters, as they relate to clinical scenarios. Covers the endocrine system, circulatory system, lymphatic system (including immunity), respiratory system, urinary system (including fluid, electrolyte, and acid-base balance), digestive system (including nutrient metabolism), and reproductive system (including prenatal development). Part II of II.",BMSP 2136 + BMSP 2146,HUMAN ANATOMY AND PHYSIOLOGY + LAB,"Structure and function of the human body for students preparing for professions in the health fields. 2135: body plan and organization, homeostasis, cell structure and function, histology, integumentary system, skeletal system, muscular system, nervous system and special senses. 2136: endocrine system, circulatory & cardiovascular system, lymphatic system and immunity, respiratory system, digestive system, metabolism, excretion, reproduction, and development. BMSP 2135 -2136 duplicates BIOL 2405-2406; may not receive credit for both. | Laboratory exercises investigating the structure and function of the human body for students preparing for professions in the health fields.  2145: body plan and organization, homeostasis, cell structure and function, histology, integumentary system, skeletal system, muscular system, nervous system and special senses. 2146: endocrine system, circulatory & cardiovascular system, lymphatic system and immunity, respiratory system, digestive system, metabolism, excretion, reproduction, and development. BMSP 2145 -2146 duplicates BIOL 2414; may not receive credit for both."
23,BLD 210 BUILDING STRUCTURES,"Introduces analysis and design of steel, wood, and reinforced concrete structural members including loads, reactions, bending moments, stresses, and deflection for selection of beam and column sizes. Considers bolted and welded connections in steel design. Introduces determination of reinforcing steel sizes and arrangements in concrete embers. Use local prerequisites.",BC 2214,WHY BUILDINGS STAND UP,"Overview of fundamental principles explaining why structures remain stable under various loading conditions. Explores different types of structures and applied loads and analyzes both determinate and indeterminately supported structures. Calculation of shear, bending moments, deflections in beams, and buckling. Discussion of ethical impacts on user safety and hazard avoidance, in project design and construction methods, materials, etc. Explores different types of soil composition and their strength properties."
24,BUS 100 INTRODUCTION TO BUSINESS,"Exposes students to the functions and topics of modern business, including economics, management, finance, accounting, marketing, production, international business, small business, and other areas of general business interest. Guides students in establishing a viable business vocabulary, fostering critical and analytical thinking, and refining business decision-making skills.",MGT 1104,FOUNDATIONS OF BUSINESS,"Introduces students to the free enterprise system and the various business functions, such as management, human resources, marketing, operations, accounting and finance, technology as well as to the different types of business such as manufacturing and service.  Analyzes the various business functions to help improve understanding of career interests and opportunities, as well as to provide a basic understanding of how a company operates.  Applies learning through a group project in which a micro-business is created and managed."
25,BUS 204 PROJECT MANAGEMENT,"Provides students with knowledge of essential skills and techniques necessary to lead or participate in projects assigned to managerial personnel. Covers time and task scheduling, resource management, problem solving strategies and other areas related to managing a project.",MGT 2114,PRINCIPLES OF PROJECT MANAGEMENT,"Broad and comprehensive overview of project management (PM) with emphasis on its application in organizations. Tools, techniques, and evaluative frameworks that are intended to solve problems and execute organizational strategy. Emphasizes project lifecycle and introduces multiple PM approaches and technologies. Change management evaluation and project manager role in implementing related strategies. Assessment of project financial performance, impact, and risk."
