,VCCS Course,VCCS Description,VT Course Code,VT Course Title,VT Description
45,CST 100 PRINCIPLES OF PUBLIC SPEAKING,"Applies theory and principles of public address with an emphasis on preparation and on the extemporaneous method of delivery. The assignments in the course require college-level reading and analysis of scholarly studies and coherent communication through written reports, including the production of at least one APA/MLA-formatted individual writing assignment. This is a UCGS transfer course.",COMM 2004,PUBLIC SPEAKING,"Strategies and practice for speaking to specific audiences. Ethical considerations for message preparation, development, presentation, and evaluation. Pre: Sophomore standing."
46,CST 110 INTRODUCTION TO HUMAN COMMUNICATION,"Examines the elements affecting human communication in individual (e.g., intrapersonal, interpersonal), small group, and public communication contexts with an emphasis on the practice of communication skills in each context. The assignments in the course require college-level reading and analysis of scholarly studies and coherent communication through written reports including the production of at least one APA/MLA-formatted individual writing assignment. This is a UCGS transfer course.",COMM 2014,COMMUNICATION PRINCIPLES OF TEAMWORK,"Behavior of people working in groups. Theories and models of communication, types of groups, principles of effective teamwork. Intrapersonal and interpersonal communication and values related to group behavior, relationships, and problem solving. Ethical issues associated with group work. Pre: Sophomore standing required."
47,CST 114 SURVEY OF MASS MEDIA,"Examines the history and current understanding of mass communication.  Covers print media (newspapers, magazines, and books), electronic media (radio, television, film, the Internet), advertising, public relations, and mass media theory, research, and ethics.",COMM 2084,MEDIA AND SOCIETY,"An examination of media influence on society. Emphasis on impact of media (such as newspapers, film, social networks, and video games) on diverse audiences and cultures. Considerations of the evolution of media; social institutions and trends related to the media; domestic, global, ethical, and legal questions posed by the media; intercultural communication; and new technologys influence on society."
48,CST 115 SMALL GROUP COMMUNICATION,"Emphasizes the development of presentational ability in a group, decision-making, group maintenance, and leadership and participant skills. Incorporates a preliminary study of group dynamics.",COMM 2014,COMMUNICATION PRINCIPLES OF TEAMWORK,"Behavior of people working in groups. Theories and models of communication, types of groups, principles of effective teamwork. Intrapersonal and interpersonal communication and values related to group behavior, relationships, and problem solving. Ethical issues associated with group work. Pre: Sophomore standing required."
49,CST 126 INTERPERSONAL COMMUNICATION,"Teaches interpersonal communication skills for both daily living and the world of work, including perception, self- concept, self-disclosure, listening and feedback, nonverbal communication, attitudes, assertiveness, and other interpersonal skills.  The assignments in the course require college-level reading and analysis of scholarly studies and coherent communication through written reports including the production of at least one APA/MLA-formatted individual writing assignment.",CMST 3124,INTERPERSONAL COMMUNICATION,Basic theories and processes of person-to-person communication; interpersonal perception; verbal and nonverbal communication; establishment of relationships in the family and work situation.  Junior standing required.
50,CST 130 INTRODUCTION TO THE THEATRE,"Surveys theatre history and the development and participants in the theatrical process. Considers history, process, style and genres, organization, written drama, and performed drama. This is a Passport and UCGS transfer course.",TA 2014,INTRODUCTION TO THEATRE,"Appreciation and understanding of theatre as a living, collaborative art form through historical and intercultural perspectives, readings of key texts and analysis of scripts, and explorations of all elements of the theater making process, including playwriting, directing, acting, and design."
51,CST 131 ACTING I,"Introduces students to the craft of acting. Covers the practice of physical and vocal warm-ups, improvisation exercises, individual and group scenes, and analytical skills.  Develops presence and communication skills. Provides students with introductory exposure to a variety of acting concepts. Part I of IV.",TA 2024,INTRODUCTION TO ACTING,"Introductory performance class in acting skills and theories as a participant (actor) and observer (audience) for the non-major.  Includes performances of dramatic literature/ improvisation for live audience, creating character biography and script analysis, historical and intercultural contexts, and techniques in constructive criticism that incorporate interpretive strategies."
52,CST 132 ACTING II,"Extends students' understanding of the craft of acting. Builds on Acting I skills through individual and group text work that include practice listening, point-of-view recognition, personalization, and text analysis. Part II of IV.",TA 2024,INTRODUCTION TO ACTING,"Introductory performance class in acting skills and theories as a participant (actor) and observer (audience) for the non-major.  Includes performances of dramatic literature/ improvisation for live audience, creating character biography and script analysis, historical and intercultural contexts, and techniques in constructive criticism that incorporate interpretive strategies."
53,CST 151 FILM APPRECIATION I,"Provides students with a critical understanding of film through the discussion and viewing of motion pictures with emphasis upon the study of film history and the forms and functions of film.  Students will develop skills to analyze the shared social, cultural and historical influences of films and their contexts.  Part I of II. This is a Passport and UCGS transfer course.",CINE 2054,INTRODUCTION TO CINEMA,"Introduction to cinema as a medium for artistic communication. Interpretation and analysis of films to understand designs, ideas and values in artistic and cultural contexts. Basic elements of cinema structure and cinema terminology, phases of cinema production, cinema style of individual directors, creative work of cinematography, production design, and editing, ideological and social meaning in cinema, demographics of visual representation, cinemas economic marketplace. Ethical values and conflicts as found in given films, and ethical reasoning as part of the analysis of cinema."
54,CST 221 PUBLIC RELATIONS,"Introduces public relations as a marketing activity and focuses on media relations, publicity, strategic planning, public relations research, communication with multiple audiences, and the elements of an effective public relations campaign to influence public opinion. Equips students with the basic skills for writing publicity materials and coordinating public relations campaigns and media kits. This course applies basic writing and communication skills to the principles of public relations. This is an upper level course intended for students planning to study in public relations or a related field. This course is cross-listed with MKT 221 . Credit will not be awarded for both.",PR 2044,PRINCIPLES OF PUBLIC RELATIONS,Principles of public relations practice; public relations in organizations; responsibilities of the public relations practitioner; legal and ethical considerations; role of public relations in society; history of the field and key people who influenced its development; choosing appropriate communication channels/media.
55,CST 227 BUSINESS AND PROFESSIONAL COMMUNICATION,"Emphasizes principles and practical application to effective professional oral communication behaviors to include speaking, listening, and relating, and rhetorical sensitivity within professional, business, and organizational contexts.",CMST 3214,PROFESSIONAL COMMUNICATION,"Theory and contemporary practice of professional oral communication, including interpersonal interaction, small group problem-solving, and public presentations. Emphasis on ethical exchanges in traditional or virtual workshops settings."
56,CST 228 WRITING ACROSS MEDIA,"Provides instruction in writing and reporting techniques within various professional media fields, to include public relations, advertising, print, broadcast, and online journalism. Focuses on information gathering, developing appropriate and accurate stories, journalistic storytelling, grammar, Associated Press Style, and knowledge of current affairs.",COMM 2024,MEDIA WRITING,"Writing and information gathering skills including news, features, press releases, and advertising copy for broadcast, print and public relations media. Sophomore Standing Required."
57,CST 229 INTERCULTURAL COMMUNICATION,Explores human communication across cultural contexts and introduces the study of intercultural communication.  Prepares students to communicate effectively within an increasingly multicultural world and globalized era.  Develops understanding and analytical skills regarding communication across cultural contexts.,HUM 3204,MULTICULTURAL COMMUNICATION,"Exploration of communication in and among various cultural groups through an examination of communicative practices, registers, discourse, and performance.  Emphasis on understanding cultural differences and similarities in the different styles and stances in communication and their meanings to participants."
58,CST 231 HISTORY OF THEATRE I,"Analyzes and studies theatre history to include architecture, performers and performance, playwrights, stage, production methods, and audience from the Greeks through modern drama. Part I of II.",TA 2014,INTRODUCTION TO THEATRE,"Appreciation and understanding of theatre as a living, collaborative art form through historical and intercultural perspectives, readings of key texts and analysis of scripts, and explorations of all elements of the theater making process, including playwriting, directing, acting, and design."
59,CST 237 MOVEMENT I,Introduces the basic techniques and theories of stage movement for the purpose of creating truthful physical behavior in the theatre. Part I of II.,TA 2144,FOUNDATIONS OF MOVEMENT AND VOICE,"An introduction to the process of acting, through a variety of laboratory experiences, beginning with basic performance skills and culminating in the performance experience. Emphasis is on various methods of performance style and analysis, theater movement and body conditioning, and vocal awareness and production.  Limited to Theatre & Cinema Majors."
60,CST 245 BASIC STAGE LIGHTING,"Provides students with a basic understanding of the principles, methods and materials of stage lighting. Instructs students in the fundamentals of stage lighting such as: functions and qualities of light, foundational principles and methods of lighting design, components of lighting instruments and equipment, basic electricity, light board operation, and safety protocol and procedures.",TA 3134,INTERMEDIATE LIGHTING DESIGN,Rotating topics in lighting design and technology.  Designed for advanced theatre arts majors who have foundational training in all areas of theatre arts.  May be repeated for credit.  (Variable credit)
61,CST 258 SCENIC DESIGN,"Introduces students to the basics of theatrical scene design including script analysis, theory, research, visual creation and presentation, construction techniques, budgeting and scope, collaboration and the importance of historical periods in art and architecture.",TA 2164,SCENE DESIGN LAB,"An introduction to the processes, technologies, and aesthetics of scene design for theatrical productions and analysis of playscripts. Students develop workshop drawing, conceptual design and vision, and collaborative skills related to scene design, and exploration is focused in historical and contemporary theatre practice. A range of design problems will offer opportunity to learn various design approaches and provide practice with different media and means of design expression. Design Lab."
62,DAN 121 DANCE APPRECIATION,"Explores the language of dance through an introduction to basic elements, forms, and diverse styles across time. Develops techniques for observing dance analytically and critically.",DANC 2014,INTRODUCTION TO DANCE HISTORY,"Survey of dance history as an art form with global scope. Language of dance criticism and dance writing practices. International dance forms and the emergence and development of 20th and 21st century modern and post-modern concert dance in the United States from the confluence of European folk and court dances, ballet, African and Caribbean influences, and other American cultural dynamics. Emphasis on ethical and aesthetic modes of viewing dance performance with attention to issues of gender and sexuality, race and ethnicity, ability, class, and identity."
63,DAN 200 HISTORY OF MODERN DANCE,"Explores the origin and development of modern dance, with concentration on American choreographers Doris Humphrey, Isadora Duncan and Martha Graham. Studies the cultural, intellectual and physical influences on the development of different techniques and movement theories as well as modern dance companies.",DANC 2014,INTRODUCTION TO DANCE HISTORY,"Survey of dance history as an art form with global scope. Language of dance criticism and dance writing practices. International dance forms and the emergence and development of 20th and 21st century modern and post-modern concert dance in the United States from the confluence of European folk and court dances, ballet, African and Caribbean influences, and other American cultural dynamics. Emphasis on ethical and aesthetic modes of viewing dance performance with attention to issues of gender and sexuality, race and ethnicity, ability, class, and identity."
64,ECO 201 PRINCIPLES OF MACROECONOMICS,"Presents the fundamental macroeconomic concepts, theories, and issues including the study of scarcity and opportunity cost, supply and demand, national economic growth, inflation, recession, unemployment, fiscal and monetary policies, and international trade. Develops an appreciation of how these economic concepts apply to consumer, business, and government decisions, and their effect on the overall economy. This is a Passport and UCGS transfer course.",ECON 2006,PRINCIPLES OF ECONOMICS,"2005: Introduction to microeconomics. The economic approach to decision-making. Model of supply and demand. Elasticities.  Consumer behavior. Firm behavior under varying industry structures. Sources and consequences of market failure. Costs and benefits of international trade. The role of government in the economy. Economic, ethical, and social ramifications of issues such as pollution, missing information, and income inequality.
2006: Introduction to macroeconomics. The measurement of economic activity. Macroeconomic problems (such as unemployment and inflation). The monetary system. Effects and limitations of monetary and fiscal policies. International economics. Social and ethical issues related to macroeconomic policy."
65,ECO 202 PRINCIPLES OF MICROECONOMICS,"Presents the fundamental microeconomic concepts, theories, and issues including the study of scarcity and opportunity cost, supply and demand, elasticities, marginal revenues and costs, profits, production and distribution. Develops an appreciation of how these economic concepts apply to consumer and business decisions, and their effect on the individual. This is a Passport and UCGS transfer course.",ECON 2005,PRINCIPLES OF ECONOMICS,"2005: Introduction to microeconomics. The economic approach to decision-making. Model of supply and demand. Elasticities.  Consumer behavior. Firm behavior under varying industry structures. Sources and consequences of market failure. Costs and benefits of international trade. The role of government in the economy. Economic, ethical, and social ramifications of issues such as pollution, missing information, and income inequality.
2006: Introduction to macroeconomics. The measurement of economic activity. Macroeconomic problems (such as unemployment and inflation). The monetary system. Effects and limitations of monetary and fiscal policies. International economics. Social and ethical issues related to macroeconomic policy."
66,EDU 200 FOUNDATIONS OF EDUCATION,"Explores the foundational topics related to education. Emphasizes the historical, philosophical, social, legal, ethical, and professional aspects of teaching. This course requires a practicum with a minimum of 20 hours of observation in a K-12 setting.",EDCI 2004,EXPLORING THE TEACHING PROFESSION - FIELD STUDIES IN EDUCATION,"Experiential learning,10 hours per week, in a classroom setting, public or private, exposing students to knowledge, skills, and dispositions of professional educators. Allows for integration of experiential and course-based learning in professional identity formation and classroom management. Introduces students to concepts and terminology necessary for upperlevel educator preparation courses."
67,EDU 250 FOUNDATIONS OF EXCEPTIONAL EDUCATION,"Explores the historical, ethical, social, cultural, and legal practices for providing educational services for individuals with exceptionalities including early intervention, inclusion, adapting environments, and supporting positive behavior.  Includes the study of characteristics of individuals with exceptionalities and the influence of culture and environment on development. Focuses on models, theories, and trends in special education.",EDCI 3144,EDUCATION OF EXCEPTIONAL LEARNERS,"Introduction to the historical, ethical, legal, and economic models relevant to understanding students with disabilities and meeting their needs to increase their potential for success throughout their lives. Addresses research in early intervention, K-12 instruction, post-secondary education, and transition into work settings."
68,EDU 254 TEACHING BASIC ACADEMIC SKILLS TO EXCEPTIONAL CHILDREN,"Develops competencies required to teach readiness and basic skills to children with special needs in private or public school settings. Includes the preparation of lesson plans, instructional units, and individualized Education Programs (IEP's). Includes child abuse recognition and intervention training. Emphasizes exceptionalities for students ages 2-21 under Public Law 94-142. Familiarizes students with the indicators of effective teaching.",EDCI 3144,EDUCATION OF EXCEPTIONAL LEARNERS,"Introduction to the historical, ethical, legal, and economic models relevant to understanding students with disabilities and meeting their needs to increase their potential for success throughout their lives. Addresses research in early intervention, K-12 instruction, post-secondary education, and transition into work settings."
69,EGR 121 FOUNDATIONS OF ENGINEERING,"Introduces the engineering profession and its impact on society and the environment, including engineering problem solving, the engineering design process, and professional practices.  Covers fundamental engineering calculations, descriptive statistics, basic spreadsheet and mathematical scripting language applications, professional ethics, teamwork, and communication",ENGE 1215,FOUNDATIONS OF ENGINEERING,"A ﬁrst-year sequence to introduce general engineering students to the profession. 1215 (2 credit) Engineering problem-solving, contemporary programming tools, professional practices and expectations (e.g. effective communication, time management, working in teams, ethics), the diversity of ﬁelds and majors within engineering, and reflective and corrective practices. 1216 (2 credits): Engineering design, criteria and constraints, data collection and analysis, testing and iteration of design solutions, contemporary CAD tools, professional practices and expectations (e.g. communication, teamwork, ethics), and reflective and corrective practices. Students must complete both ENGE 1215 and ENGE 1216 to earn Pathways credit. 1215: Design Lab/Studio, 1216: Design Lab/Studio. Duplicates ENGE 1414 ."
70,EGR 140 ENGINEERING MECHANICS - STATICS,"Introduces mechanics of vector forces and space, scalar mass and time, including S.I. and U.S. customary units. Teaches equilibrium, free-body diagrams, moments, couples, distributed forces, centroids, moments of inertia analysis of two- force and multi-force members and friction and internal forces.",ESM 2104,STATICS,"Vector mechanics of forces and moments, free-body diagrams, couples, resultants, equilibrium of particles and rigid bodies in two and three dimensions, forces in trusses, frames, and machines, centroids, centers of mass, distributed forces, internal shear forces and bending moments in beams, shear and moment diagrams, friction, belt friction, area of moments of inertia, parallel axis theorem."
71,EGR 231 MASS AND ENERGY BALANCES,"Introduces the field of chemical engineering and how material and energy balances are applied to chemical processes, and physical and thermodynamic properties of multi-component systems.",CHE 2114,MASS AND ENERGY BALANCES,"Stoichiometric and composition relationships, behavior of gases, vapor pressures, solubility, mass balances, recycling operations, energy balances, first law of thermodynamics, thermophysics, thermochemistry, fuels and combustion, application to chemical operations."
72,EGR 232 CHEMICAL ENGINEERING THERMODYNAMICS,"Introduces the first and second laws of thermodynamics.  Examines energy conservation; concepts of equilibrium, temperature, energy, and entropy; partial molar properties; pure component and mixture equations of state; processes involving energy transfer as work and heat; reversibility and irreversibility; and closed and open systems and cyclic processes.",CHE 2164,CHEMICAL ENGINEERING THERMODYNAMICS,"First and Second Laws, properties of fluids, properties of homogeneous mixtures; phase equilibria, chemical-reaction equilibria. Grade of C- or better required in prerequisite CHE 2114 ."
73,EGR 240 STATICS,"Introduces basic concepts of engineering mechanics, systems of forces and couples, equilibrium of particles and rigid bodies, and internal forces and analysis of structures, including SI and U.S. customary units. Includes trusses, frames, machines, beams, distributed forces, friction, and centroids.",ESM 2104,STATICS,"Vector mechanics of forces and moments, free-body diagrams, couples, resultants, equilibrium of particles and rigid bodies in two and three dimensions, forces in trusses, frames, and machines, centroids, centers of mass, distributed forces, internal shear forces and bending moments in beams, shear and moment diagrams, friction, belt friction, area of moments of inertia, parallel axis theorem."
74,EGR 245 DYNAMICS,"Presents approach to kinematics and kinetics of particles (and systems of particles) in linear and curvilinear motion. Includes kinematics and kinetics of rigid bodies in plane motion.  Teaches Newton's second law, work-energy, and impulse-momentum methods.",ESM 2304,DYNAMICS,"Vector treatment of the kinematics and kinetics of particles and rigid bodies, Newtons laws, work and energy, impulse and momentum, impact, mass moments of inertia, rotating axes."
75,EGR 246 MECHANICS OF MATERIALS,"Introduces concepts of stress, strain, deformation, internal equilibrium, and basic properties of engineering materials. Analyzes axial loads, torsion, bending, shear and combined loading. Studies stress transformation, principal stresses, and buckling.",ESM 2204,MECHANICS OF DEFORMABLE BODIES,"Concepts of stress, strain, and deformation.  Factor of safety.  Stress-strain relationships and material properties.  Stress concentrations.  Area moments of inertia.  Axially loaded members, torsionally loaded members, bending of beams.  Shear and moment diagrams. Stresses due to combined loading.  Thin-walled pressure vessels.  Transformation of stress including Mohrs circle. Beam deflections and buckling stability."
76,EGR 260 CIRCUIT ANALYSIS,"Covers topics in linear circuit analysis, including basic electrical properties, resistive circuits, network equations, operational amplifiers, network reduction techniques, network theorems, two-port parameters and networks, inductors, capacitors, first-order circuits, second-order circuits and phasor analysis.",ECE 3054,ELECTRICAL THEORY,"For students in curricula other than ECE or ME. Fundamentals of electric circuits and electronic devices. Fundamentals of electric circuits: circuit laws and network theorems, operational amplifiers, energy storage elements, response of first (Resistive-Inductive RL, and Resistive Capacitive RC) and second order (Resistive-Inductive-Capacitive RLC) systems, Alternating Current (AC) steady state analysis. Basic electronic devices: Diodes and Transistors."
77,EGR 280 FOUNDATIONS OF ENVIRONMENTAL ENGINEERING,"Provides an introduction to the concepts of environmental engineering including air pollution, water pollution, water treatment, waste management, and health risk assessment. Examines sustainability and global climate change in the context of contemporary environmental engineering.",CEE 3104,INTRODUCTION TO ENVIRONMENTAL ENGINEERING,"Overall view of environmental engineering with emphasis on hazardous waste management, water treatment, wastewater treatment, air pollution and its control, solid waste management, groundwater pollution and environmental regulations."
