,VCCS Course,VCCS Description,VT Course Code,VT Course Title,VT Description
117,GOL 110 EARTH SYSTEMS: AN ENVIRONMENTAL GEOLOGY PERSPECTIVE,"Introduces concepts in earth systems including earth materials, plate tectonics, weathering, surface and groundwater, wasting, volcanoes, earthquakes and coastal, as well as pollution and climate change. Explores major topics relating human interaction with the physical environment through case studies.  Reinforces applications through laboratory experiments, demonstrations, and field studies. This is a Passport and UCGS transfer course.",GEOS 1004 + GEOS 1104,EARTH SCIENCE + LAB,"Introduction to Earth science, including the fundamental concepts of geology in the modern context of humans interacting with the Earth. Formation and evolution of the Earth (history, plate tectonics, the rock cycle, geologic time), internal Earth dynamics (earthquakes, volcanoes, mitigating natural hazards), Earth materials (minerals and rocks, energy and mineral resources), surface processes (Earth system science, hydrologic cycle, global geochemical cycles, oceans and atmosphere, climate, erosion and landscapes), Earth sustainability (resources, environmental change), evaluating geological information and products of research, the scientific approach to problem solving, and the ethical issues associated with geoscience and the environment. | Introduction to Earth sciences laboratory, including identification of minerals and rocks, topographic and geologic maps, structural geology, geology impacting humans and humans impacting geology, environmental and social impacts."
118,HIM 113 MEDICAL TERMINOLOGY AND DISEASE PROCESSES I,"Includes the study of prefixes, suffixes, stem words, and technical terms; puts emphasis on the causes and treatment of selected disease processes.  Part I of II.",HNFE 2204,MEDICAL TERMINOLOGY,"Structure, pronunciation, and use of medical terms; anatomical structures and body systems; terms used in pathology, testing, diagnosis, surgery, pharmacology and treatment."
119,HIM 114 MEDICAL TERMINOLOGY AND DISEASE PROCESSES II,"Continues the study of prefixes, suffixes, stem words, and technical term; puts emphasis on the causes and treatment of selected disease processes.  Part II of II.",HNFE 2204,MEDICAL TERMINOLOGY,"Structure, pronunciation, and use of medical terms; anatomical structures and body systems; terms used in pathology, testing, diagnosis, surgery, pharmacology and treatment."
120,HIS 101 WESTERN CIVILIZATIONS PRE-1600 CE,Examines the development of western civilization from ancient times to 1600 CE. This is a Passport and UCGS transfer course.,HIST 1025,INTRO EUROPEAN HISTORY,"Examines the political, social, and cultural history of Europe since the medieval period. Focuses on the complex interplay between demographic transformation, social and political change, and cultural development. 1025: Explores the legacy of the Roman Empire, the expansion and consolidation of “Europe,” the medieval world and expansion in the Atlantic World. 1026: Explores the rise of Absolutism and the Enlightenment, the Age of Revolutions, imperialism, the rise of new political ideologies and nation-building, and Europe in the twentieth century world."
121,HIS 102 WESTERN CIVILIZATIONS POST-1600 CE,Examines the development of western civilization from 1600 CE to the present. This is a Passport and UCGS transfer course.,HIST 1026,INTRO EUROPEAN HISTORY,"Examines the political, social, and cultural history of Europe since the medieval period. Focuses on the complex interplay between demographic transformation, social and political change, and cultural development. 1025: Explores the legacy of the Roman Empire, the expansion and consolidation of “Europe,” the medieval world and expansion in the Atlantic World. 1026: Explores the rise of Absolutism and the Enlightenment, the Age of Revolutions, imperialism, the rise of new political ideologies and nation-building, and Europe in the twentieth century world."
122,HIS 111 WORLD CIVILIZATIONS PRE-1500 CE,"Surveys the history of Asia, Africa, the Americas, and Europe from antiquity to approximately 1500. This is a Passport and UCGS transfer course.",HIST 1215,INTRO TO WORLD HISTORY,"Examine political, economic, social, and cultural change around the world over the course of human existence, with particular emphasis connections and comparisons of human societies across space and time. 1215: Covers early civilizations to 1500 CE. Major themes include the development of human civilization and the interactions of different societies through exchange of people, ideas, goods, and disease. 1216: Covers from 1500 CE to present. Major themes include the spread of European imperialism and resistance to it, development of nation-states, world wars, and post-colonial globalization."
123,HIS 112 WORLD CIVILIZATIONS POST-1500 CE,"Surveys the history of Asia, Africa, Europe, and the Americas from approximately 1500 CE through the present. This is a Passport and UCGS transfer course.",HIST 1216,INTRO TO WORLD HISTORY,"Examine political, economic, social, and cultural change around the world over the course of human existence, with particular emphasis connections and comparisons of human societies across space and time. 1215: Covers early civilizations to 1500 CE. Major themes include the development of human civilization and the interactions of different societies through exchange of people, ideas, goods, and disease. 1216: Covers from 1500 CE to present. Major themes include the spread of European imperialism and resistance to it, development of nation-states, world wars, and post-colonial globalization."
124,HIS 121 UNITED STATES HISTORY TO 1877,"Introduces the history of the United States from its origins to 1877.  Includes the European exploration, development of the American colonies and their institutions, the Revolution, major political, social and economic developments, geographical expansion, the Civil War, and Reconstruction. This is a Passport and UCGS transfer course.",HIST 1115,HISTORY OF THE U.S.,"Examines the history of the United States through intersections of politics, economics, sciences, the arts and significant social movements.  Considers how the modern United States has emerged through the interactions of diverse ethnic, racial, national, class, and religious groups.  1115:  pre-Columbian societies through the Civil War; 1116:  Reconstruction through present.  Sequence recommended as preparation for advanced courses in United States history."
125,HIS 122 UNITED STATES HISTORY SINCE 1865,"Introduces the history of the United States from 1865 to present.  Includes major political, social and economic developments since 1865, overseas expansion, the two world wars, the Cold War and the post-Cold War era. This is a Passport and UCGS transfer course.",HIST 1116,HISTORY OF THE U.S.,"Examines the history of the United States through intersections of politics, economics, sciences, the arts and significant social movements.  Considers how the modern United States has emerged through the interactions of diverse ethnic, racial, national, class, and religious groups.  1115:  pre-Columbian societies through the Civil War; 1116:  Reconstruction through present.  Sequence recommended as preparation for advanced courses in United States history."
126,HIS 125 HISTORY OF THE AMERICAN INDIAN,Examines the history and culture of the native peoples of the Americas.,AINS 1104,INTRODUCTION TO AMERICAN INDIANS STUDIES,Description not found
127,HIS 126 WOMEN IN WORLD HISTORY,Studies the role of women and attitudes toward women from ancient times to the present.,HIST 2124,CRITICAL ISSUES IN WORLD HISTORY,"Introduction to the problems, methods and fundamental skills of the discipline of history through the study of significant themes and critical issues in world history. Emphasis on the study of source materials and historical interpretations. Specific thematic content is variable. Examines political, economic, social, and cultural change at historically specific periods of time around the world with a focus on drawing comparisons and making connections across regional spaces. Specific topics may vary from semester to semester. May be repeated two times with different content for a maximum of 9 credit hours."
128,HIS 127 WOMEN IN AMERICAN HISTORY,Studies the role of women and attitudes toward women in American society from colonial times to the present.,HIST 2104,CRITICAL ISSUES IN U.S. HISTORY,"Introduction to the problems, methods and skills of the discipline of history through the study of significant themes and critical issues in the history of the United States. Emphasis on the study of source materials and historical interpretations of specific themes in American history. Themes grounded in issues of class, race, gender, and equality in US history. Specific topics will vary from semester to semester. Course may be repeated twice for a maximum of 9 credits."
129,HIS 141 AFRICAN-AMERICAN HISTORY I,Surveys the history of African Americans from their African origins to 1876.,HIST 2275,AFRICAN-AMERICAN HISTORY,"2275: African continent through Civil War. Examines trajectory of slavery as well as its global impacts and legacy, the development of racial thought, slave resistance and rebellions, the fight for Emancipation, and African American contributions to culture, economics and society of United States. 
2276: Reconstruction through present. Examines impact and legacy of Reconstruction, the fight against Jim Crow segregation, and the social, cultural, political and economic contributions of African Americans in the nineteenth and twentieth century United States. Exploration of the global implications of race relations in the United States."
130,HIS 142 AFRICAN-AMERICAN HISTORY II,Surveys the history of black Americans from their African origins to the present.  Part II of II.,HIST 2276,AFRICAN-AMERICAN HISTORY,"2275: African continent through Civil War. Examines trajectory of slavery as well as its global impacts and legacy, the development of racial thought, slave resistance and rebellions, the fight for Emancipation, and African American contributions to culture, economics and society of United States. 
2276: Reconstruction through present. Examines impact and legacy of Reconstruction, the fight against Jim Crow segregation, and the social, cultural, political and economic contributions of African Americans in the nineteenth and twentieth century United States. Exploration of the global implications of race relations in the United States."
131,HIS 155 LIFE IN COLONIAL VIRGINIA,"Studies life in Virginia before the American Revolution, including politics, economics, customs, culture, and the slave plantation system.",HIST 2104,CRITICAL ISSUES IN U.S. HISTORY,"Introduction to the problems, methods and skills of the discipline of history through the study of significant themes and critical issues in the history of the United States. Emphasis on the study of source materials and historical interpretations of specific themes in American history. Themes grounded in issues of class, race, gender, and equality in US history. Specific topics will vary from semester to semester. Course may be repeated twice for a maximum of 9 credits."
132,HIS 203 HISTORY OF AFRICAN CIVILIZATION,"Examines major social, economic, political and religious developments across the African continent from earliest times to the present. The assignments in the course require college-level reading fluency and coherent communication through written reports.",HIST 1515,HISTORY OF AFRICA,Description not found
133,HIS 204 HISTORY OF AFRICAN CIVILIZATIONS II,"Examines major social, economic, political and religious developments from earliest times to the present.  Part II of II.",HIST 1516,HISTORY OF AFRICA,"Examines political, economic, social and cultural themes in African history from the beginnings of human civilization to the recent past, with particular emphasis on historical experiences of race, gender, class, religion, ethnicity and nationality.  1515: Covers early civilizations thorugh the abolitionof the slave trade.  Examines migrations and trade, the expansion of Islam, and slavery in African and the Atlantic and Indian Oceans.  1516: Covers Africa since the nineteenth century.  Examines European conquest, and major political, cultural and social changes during the colonial and post-colonial eras."
134,HIS 205 LOCAL HISTORY,Studies the history of the local community and/or region.,HIST 2104,TOPICS AND CRITICAL ISSUES IN U.S. HISTORY,"Introduction to the problems, methods and skills of the discipline of history through the study of significant themes and critical issues in the history of the United States. Emphasis on the study of source materials and historical interpretations of specific themes in American history. Themes grounded in issues of class, race, gender, and equality in US history. Specific topics will vary from semester to semester. Course may be repeated twice for a maximum of 9 credits."
135,HIS 218 INTRODUCTION TO DIGITAL HISTORY,"Introduces the methods, theories and practices of digital history.",HIST 3774,DIGITAL HISTORY,"Develops skills and methods for researching and presenting history in a digital environment, with special emphasis on use of digital media as a tool for public historians."
136,HIS 225 TOPICS IN EUROPEAN HISTORY I,Examines selected topics in the history of Europe from ancient times to the present.  Part I of II.,HIST 2114,CRITICAL ISSUES IN EUROPEAN HISTORY,"Introduction to the problems, methods and skills of the discipline of history through the study of significant themes and critical issues in European history. Emphasis on the study of source materials and historical interpretations. Specific thematic content is variable. Themes grounded in European history/Europe’s role in world that interrogate the concept of “the West.” Specific topics will vary from semester to semester. Course may be repeated twice for a maximum of 9 credits."
137,HIS 226 TOPICS IN EUROPEAN HISTORY II,Examines selected topics in the history of Europe from ancient times to the present.  Part II of II.,HIST 2114,CRITICAL ISSUES IN EUROPEAN HISTORY,"Introduction to the problems, methods and skills of the discipline of history through the study of significant themes and critical issues in European history. Emphasis on the study of source materials and historical interpretations. Specific thematic content is variable. Themes grounded in European history/Europe’s role in world that interrogate the concept of “the West.” Specific topics will vary from semester to semester. Course may be repeated twice for a maximum of 9 credits."
138,HIS 231 INTRODUCTION TO LATIN AMERICAN HISTORY,Examines the development of Latin American civilizations from the pre-Columbian era to the present,HIST 1224,INTRO TO LATIN AMERICA,Description not found
139,HIS 232 HISTORY OF LATIN AMERICAN CIVILIZATIONS II,Examines Latin American civilizations from pre-Columbian origins to the present.  Part II of II.,HIST 1224,CONQUEST AND CULTURE IN LATIN AMERICAN EMPIRES,Description not found
140,HIS 241 HISTORY OF RUSSIA I,"Surveys history of Russia from earliest times to the present. Includes political, economic, multi-national, social, and cultural aspects of Russian and Soviet history.  Part I of II.",HIST 2114,CRITICAL ISSUES IN EUROPEAN HISTORY,"Introduction to the problems, methods and skills of the discipline of history through the study of significant themes and critical issues in European history. Emphasis on the study of source materials and historical interpretations. Specific thematic content is variable. Themes grounded in European history/Europe’s role in world that interrogate the concept of “the West.” Specific topics will vary from semester to semester. Course may be repeated twice for a maximum of 9 credits."
141,HIS 242 HISTORY OF RUSSIA II,"Surveys history of Russia from earliest times to the present. Includes political, economic, multi-national, social, and cultural aspects of Russian and Soviet history.  Part II of II.",HIST 2114,CRITICAL ISSUES IN EUROPEAN HISTORY,"Introduction to the problems, methods and skills of the discipline of history through the study of significant themes and critical issues in European history. Emphasis on the study of source materials and historical interpretations. Specific thematic content is variable. Themes grounded in European history/Europe’s role in world that interrogate the concept of “the West.” Specific topics will vary from semester to semester. Course may be repeated twice for a maximum of 9 credits."
142,HIS 243 HISTORY OF THE ANCIENT WORLD I,Studies the history of the ancient world from the dawn of civilization in the Near East to the fall of Rome.  Part I of II.,HIST 1024,ANCIENT HISTORY,"Surveys the civilizations and peoples of Greece, Rome, and the Ancient Near East (including Egypt and Mesopotamia) from the invention of writing around 3,000 B.C. to the fall of the Roman Empire in the fifth century C.E. through study of literature as well as archaeological artificts.  Examines the interactions and interdependencies of these civilizations and considers their enduring influence."
143,HIS 251 HISTORY OF MIDDLE EAST CIVILIZATION I,"Surveys intellectual, cultural, social, economic and religious patterns in the civilizations of the Middle East. Covers Semitic, Indo-European, and Turkic-speaking peoples from pre-Islamic to the present.  Part I of II.",HIST 2345,HIST MIDDLE EAST,"History of the Middle East from the seventh century to today, with emphasis on formation of Islamic civilization, medieval and early modern political systems, European imperialism, and the struggle for independence. 2345: seventh century to 1914; 2346: independence, wars, revolutions, and social change since 1914."
144,HIS 252 HISTORY OF MIDDLE EAST CIVILIZATION II,"Surveys intellectual, cultural, social, economic and religious patterns in the civilizations of the Middle East. Covers Semitic, Indo-European, and Turkic-speaking peoples from pre-Islamic to the present.  Part II of II.",HIST 2346,HIST MIDDLE EAST,"History of the Middle East from the seventh century to today, with emphasis on formation of Islamic civilization, medieval and early modern political systems, European imperialism, and the struggle for independence. 2345: seventh century to 1914; 2346: independence, wars, revolutions, and social change since 1914."
145,HIS 253 HISTORY OF ASIAN CIVILIZATIONS I,Surveys the civilizations of Asia from their origins to the present.  Part I of II.,HIST 2124,TOPICS AND CRITICAL ISSUES IN WORLD HISTORY,"Introduction to the problems, methods and fundamental skills of the discipline of history through the study of significant themes and critical issues in world history. Emphasis on the study of source materials and historical interpretations. Specific thematic content is variable. Examines political, economic, social, and cultural change at historically specific periods of time around the world with a focus on drawing comparisons and making connections across regional spaces. Specific topics may vary from semester to semester. May be repeated two times with different content for a maximum of 9 credit hours."
146,HIS 254 HISTORY OF MODERN EAST ASIAN CIVILIZATIONS,Examines East Asian civilizations from the early modern period through the present day.,HIST 2124,TOPICS AND CRITICAL ISSUES IN WORLD HISTORY,"Introduction to the problems, methods and fundamental skills of the discipline of history through the study of significant themes and critical issues in world history. Emphasis on the study of source materials and historical interpretations. Specific thematic content is variable. Examines political, economic, social, and cultural change at historically specific periods of time around the world with a focus on drawing comparisons and making connections across regional spaces. Specific topics may vary from semester to semester. May be repeated two times with different content for a maximum of 9 credit hours."
147,HIS 256 HISTORY OF JAPANESE CULTURE & INSTITUTIONS,"Examines traditional Japanese social, political, economic, and military institutions. Also examines major literary, artistic and intellectual achievements from pre-historic times to the present.",HIST 2364,HISTORY OF JAPAN,"Political, social, economic, and cultural development of Japan from earliest times to present; emphasis on problems of modernization in the nineteenth and the twentieth centuries."
148,HIS 261 TOPICS IN CULTURAL ETHNICITY I,"Cultural experiences of various ethnic groups in the United States, e.g. the Irish, Italians, Jews, Germans, etc.",HIST 2104,TOPICS AND CRITICAL ISSUES IN US HISTORY,"Introduction to the problems, methods and skills of the discipline of history through the study of significant themes and critical issues in the history of the United States. Emphasis on the study of source materials and historical interpretations of specific themes in American history. Themes grounded in issues of class, race, gender, and equality in US history. Specific topics will vary from semester to semester. Course may be repeated twice for a maximum of 9 credits."
149,HIS 262 UNITED STATES HISTORY IN FILM,"Examines selected topics in the United States history which shaped the American experience, presented in film.",HIST 3694,HISTORY THROUGH FILM,"This course introduces students to critical issues in history and representation, utilizing film to analyze central historical issues.  The specific thematic content is variable.  Course may be repeated for up to 9 credits."
150,HIS 266 MILITARY HISTORY OF THE CIVIL WAR,"Analyzes military campaigns of the Civil War, including factors contributing to the defeat of the Confederacy and problems created by the war. May include field trips to Civil War sites in the region.",HIST 2104,TOPICS AND CRITICAL ISSUES IN US HISTORY,"Introduction to the problems, methods and skills of the discipline of history through the study of significant themes and critical issues in the history of the United States. Emphasis on the study of source materials and historical interpretations of specific themes in American history. Themes grounded in issues of class, race, gender, and equality in US history. Specific topics will vary from semester to semester. Course may be repeated twice for a maximum of 9 credits."
151,HIS 267 THE SECOND WORLD WAR,"Examines causes and consequences of the Second World War. Includes the rise of totalitarianism, American neutrality, military developments, the home fronts, diplomacy, and the decision to use the atomic bomb.",HIST 3544,WORLD WAR II,"Examines the origins, nature, and consequences of the Second World War in transnational perspective.  Discussion of social, economic, political and diplomatic conditions that led to and shaped the conduct of the war.  Engagement with diverse perspectives on the war and its implications through primary and secondary source materials."
152,HIS 268 THE AMERICAN CONSTITUTION,"Analyzes the origin and development of the United States Constitution. Includes the evolution of civil liberties, property rights, contracts, due process, judicial review, federal-state relationships, and corporate-government relations.",HIST 2104,TOPICS AND CRITICAL ISSUES IN US HISTORY,"Introduction to the problems, methods and skills of the discipline of history through the study of significant themes and critical issues in the history of the United States. Emphasis on the study of source materials and historical interpretations of specific themes in American history. Themes grounded in issues of class, race, gender, and equality in US history. Specific topics will vary from semester to semester. Course may be repeated twice for a maximum of 9 credits."
153,HIS 269 CIVIL WAR & RECONSTUCTION,"Studies factors that led to the division between the States. Examines the war, the home fronts, and the era of Reconstruction.",HIST 2104,TOPICS AND CRITICAL ISSUES IN US HISTORY,"Introduction to the problems, methods and skills of the discipline of history through the study of significant themes and critical issues in the history of the United States. Emphasis on the study of source materials and historical interpretations of specific themes in American history. Themes grounded in issues of class, race, gender, and equality in US history. Specific topics will vary from semester to semester. Course may be repeated twice for a maximum of 9 credits."
154,HIS 270 AMERICA IN THE GILDED AGE,"Studies in detail American history during the years from 1870-1900 - The Gilded Age, emphasizing the relationships between various aspects of American life and identifying themes that helped define the era.",HIST 2104,TOPICS AND CRITICAL ISSUES IN US HISTORY,"Introduction to the problems, methods and skills of the discipline of history through the study of significant themes and critical issues in the history of the United States. Emphasis on the study of source materials and historical interpretations of specific themes in American history. Themes grounded in issues of class, race, gender, and equality in US history. Specific topics will vary from semester to semester. Course may be repeated twice for a maximum of 9 credits."
